"ROCO_00001",Axial MRI (coronal view).","Axial MRI (coronal view)."
"ROCO_00006","Coronal plain computed tomography image showing multiple large tumor masses with edge enhancement inside the abdominal cavity and liver.","Coronal plain computed tomography image showing multiple large tumor masses with edge enhancement inside the abdominal cavity and liver."
"ROCO_00016","Axial source image from an intracranial magnetic resonance angiogram reveals abnormal arterial signal elevation in the left more than right cavernous sinuses consistent with a carotid cavernous fistula, as indicated by the arrow.","Axial source image from an intracranial magnetic resonance angiogram reveals abnormal arterial signal elevation in the left more than right cavernous sinuses consistent with a carotid cavernous fistula, as indicated by the arrow."
"ROCO_00025","The apical height, homogeneity, and the thickness of mineral trioxide aggregate plug","The apical height, homogeneity, and the thickness of mineral trioxide aggregate plug"
"ROCO_00031","CTO of RCA (closure in the 2nd segment)","CTO of RCA (closure in the 2nd segment)"
"ROCO_00036","Venography shows a large amount of thrombogenesis in the femoropoplitea vein before thrombolysis.","Venography shows a large amount of thrombogenesis in the femoropoplitea vein before thrombolysis."
"ROCO_00025","The apical height, homogeneity, and the thickness of mineral trioxide aggregate plug","The apical height, homogeneity, and the thickness of mineral trioxide aggregate plug"
